{
  "investor": "TechVest Partners IV",
  "mandate_id": "tvp4-2026",
  "version": "1.0",
  "created_at": "2026-04-01",
  "updated_at": "2026-04-30",
  "description": "Mid-market software/fintech growth equity fund targeting $5-30M checks with 25%+ IRR in N.America and select APAC markets. Focus on SaaS, lending, payments, and trade finance.",
  "process_criteria": {
    "primary_use_of_capital": [
      "acquisition",
      "growth",
      "infrastructure"
    ],
    "hold_period_years": [3, 7],
    "check_size_usd_millions": [5, 30],
    "target_irr_percent": 25,
    "geography": ["US", "CA", "GB", "SG", "AU"],
    "sectors": [
      "software",
      "saas",
      "fintech",
      "payments",
      "trade_finance",
      "supply_chain"
    ],
    "exclude_sectors": [
      "defense",
      "weapons",
      "fossil_fuels",
      "gambling",
      "tobacco"
    ],
    "max_decision_days": 60
  },
  "legal_criteria": {
    "required_governance": [
      "board_seat",
      "information_rights",
      "veto_rights"
    ],
    "liquidation_preference": "non_participating",
    "allowed_anti_dilution_types": [
      "broad_based_weighted_average"
    ],
    "max_non_compete_years": 2,
    "requires_drag_along": true,
    "requires_tag_along": true,
    "min_founder_vest_years": 4,
    "required_carveouts": [
      "founder_friendly",
      "equity_pool"
    ],
    "acceptable_mac_scope": "standard"
  },
  "compliance_criteria": {
    "allowed_jurisdictions": [
      "US",
      "CA",
      "GB",
      "DE",
      "SG",
      "AU"
    ],
    "aml_kyc_required": true,
    "blocked_sectors": [
      "gambling",
      "weapons",
      "tobacco",
      "fossil_fuels"
    ],
    "sanctions_check_required": true,
    "pep_screening_required": true,
    "min_esg_rating": "yellow",
    "export_control_acceptable": false,
    "requires_privacy_compliance": true,
    "max_reputational_risk": "minor",
    "reputational_review_required": true
  },
  "metadata": {
    "fund_size_usd_millions": 250,
    "target_portfolio_size": 10,
    "key_contact": "deals@techvestpartners.com",
    "approval_required_from": [
      "investment_committee"
    ]
  }
}
